
<!DOCTYPE producto SYSTEM "Producto.dtd">
<producto id="0">
    <nombre>Patatas</nombre>
    <cantidad>100</cantidad>
    <tipo>Plantaci√≥n</tipo>
    <unidades>Kilos</unidades>
    <precio>1.0</precio>
    <plantacion id="0">
        <ultimo_regado>2021-05-20</ultimo_regado>
        <hectareas>1003.0</hectareas>
    </plantacion>
</producto>
